{
  "schema_version": "1.0.0",
  "inquiry_id": "condition-inquiry:synthetic-state-filter:v1",
  "created_at": "2026-08-31T16:35:00+02:00",
  "updated_at": "2026-08-31T16:35:00+02:00",
  "agent_contract_version": "1.0.0",
  "research_id": "research:synthetic-condition-inquiry",
  "input_artifact_refs": [
    "concept-audit:synthetic-prose-strategy:v1",
    "instrument:synthetic-state-filter"
  ],
  "purpose": "MEASUREMENT_ASSESSMENT",
  "base_claim": {
    "claim_ref": "claim:synthetic-filter-question",
    "statement": "The fixed state filter separates observations with different future behavior for its stated predictive purpose.",
    "relationship_to_source_strategy": "MEASUREMENT_QUESTION"
  },
  "measurement_assessment": {
    "instrument_ref": "instrument:synthetic-state-filter",
    "stated_purpose": "Distinguish the source-labelled context from other observations before examining the source strategy.",
    "construction_inputs": [
      "past prices",
      "past realized variability"
    ],
    "future_discrimination_targets": [
      "future directional response",
      "future path shape",
      "incremental predictive information beyond the raw inputs"
    ],
    "targets_reused_in_construction": false,
    "label_share": null,
    "incremental_baseline": "Compare the filter with its own continuous inputs and with a simple no-filter baseline.",
    "conclusion": "NOT_YET_ASSESSED",
    "failure_scope": "UNCONDITIONED_EVENT_CLAIM_MAY_REMAIN_OPEN",
    "label_share_alone_validates_instrument": false,
    "predictive_separation_establishes_real_state": false,
    "predictive_separation_establishes_cause": false,
    "note": "A frequent label is not evidence of poor or good discrimination. The inquiry asks whether future behavior differs in a way not already built into the filter."
  },
  "candidate_conditions": [
    {
      "condition_id": "condition:synthetic-volatility-modifier",
      "statement": "The filter's predictive usefulness may vary with volatility known at classification time.",
      "origin": "CONCEPT_AUDIT",
      "relationship_to_strategy": "PERFORMANCE_MODIFIER",
      "known_at_decision_time": "YES",
      "status": "UNEXAMINED",
      "new_hypothesis_required": true,
      "evidence_refs": [],
      "note": "If suggested by discovery data, it remains a new condition hypothesis rather than a missing source rule."
    }
  ],
  "method_plan": [
    {
      "method_id": "method:synthetic-structural-map",
      "method_type": "STRUCTURAL_DEPENDENCY_MAP",
      "stage": "STRUCTURAL_PRE_DATA",
      "question": "Which filter inputs are reused in the proposed outcomes or comparisons?",
      "outputs": ["dependency map", "outcomes unsuitable for instrument assessment"],
      "interpretation_limit": "A shared component shows a possible construction-induced association; it neither proves nor disproves a market mechanism."
    },
    {
      "method_id": "method:synthetic-conditional-ability",
      "method_type": "CONDITIONAL_PREDICTIVE_ABILITY",
      "stage": "DISCOVERY",
      "question": "Can information known at classification time predict when the filter adds useful separation?",
      "outputs": ["conditional performance differences", "candidate condition hypotheses"],
      "interpretation_limit": "A discovered modifier is exploratory and cannot be inserted retroactively into the source strategy."
    },
    {
      "method_id": "method:synthetic-stability",
      "method_type": "PERFORMANCE_FLUCTUATION_TEST",
      "stage": "INDEPENDENT_EVALUATION",
      "question": "Does the proposed condition recur across time rather than appearing in one isolated interval?",
      "outputs": ["time path of relative performance", "stability assessment"],
      "interpretation_limit": "Stability supports transportability of a predictive relation but does not establish causation or a literal market regime."
    }
  ],
  "interpretation_contract": {
    "unknown_conditions_remain_unknown": true,
    "data_discovered_conditions_are_new_hypotheses": true,
    "association_is_not_causal_evidence": true,
    "predictive_separation_is_not_real_state_proof": true,
    "source_claim_not_silently_replaced": true,
    "note": "The inquiry generates and evaluates condition hypotheses. It does not claim complete knowledge of prerequisites and does not rewrite the source strategy."
  },
  "inquiry_status": "PLAN",
  "overall_note": "Synthetic plan only. It illustrates the general condition-inquiry contract and contains no market result or strategy test."
}
